{
  "assignments": [
    {
      "actor_id": "github-user:271768688",
      "approving_actor_ids": [
        "github-user:271768688"
      ],
      "assignment_id": "repository_owner:1",
      "assignment_index": 1,
      "authentication_evidence_digest": "sha256:fd5b45c1d440fe4a3fddbb5dfad75ad435de9548654c008b76b75c4c86261bd1",
      "blocking_reasons": [],
      "custody_domain": "repository",
      "deputy_actor_id": null,
      "effective_at_utc": "2026-07-30T07:34:50Z",
      "expires_at_utc": null,
      "github_actor_id": 271768688,
      "github_login": "gomez5757",
      "incompatibility_set_digest": "sha256:fd5b45c1d440fe4a3fddbb5dfad75ad435de9548654c008b76b75c4c86261bd1",
      "recovery_evidence_digest": "sha256:fd5b45c1d440fe4a3fddbb5dfad75ad435de9548654c008b76b75c4c86261bd1",
      "role": "repository_owner",
      "status": "active",
      "transition_event_digest": "sha256:fd5b45c1d440fe4a3fddbb5dfad75ad435de9548654c008b76b75c4c86261bd1"
    },
    {
      "actor_id": "github-user:271768688",
      "approving_actor_ids": [
        "github-user:271768688"
      ],
      "assignment_id": "implementer:1",
      "assignment_index": 1,
      "authentication_evidence_digest": "sha256:fd5b45c1d440fe4a3fddbb5dfad75ad435de9548654c008b76b75c4c86261bd1",
      "blocking_reasons": [],
      "custody_domain": "repository",
      "deputy_actor_id": null,
      "effective_at_utc": "2026-07-30T07:34:50Z",
      "expires_at_utc": null,
      "github_actor_id": 271768688,
      "github_login": "gomez5757",
      "incompatibility_set_digest": "sha256:fd5b45c1d440fe4a3fddbb5dfad75ad435de9548654c008b76b75c4c86261bd1",
      "recovery_evidence_digest": "sha256:fd5b45c1d440fe4a3fddbb5dfad75ad435de9548654c008b76b75c4c86261bd1",
      "role": "implementer",
      "status": "active",
      "transition_event_digest": "sha256:fd5b45c1d440fe4a3fddbb5dfad75ad435de9548654c008b76b75c4c86261bd1"
    },
    {
      "actor_id": "github-user:271768688",
      "approving_actor_ids": [
        "github-user:271768688"
      ],
      "assignment_id": "workflow_reviewer:1",
      "assignment_index": 1,
      "authentication_evidence_digest": "sha256:fd5b45c1d440fe4a3fddbb5dfad75ad435de9548654c008b76b75c4c86261bd1",
      "blocking_reasons": [],
      "custody_domain": "independent_review",
      "deputy_actor_id": null,
      "effective_at_utc": "2026-07-30T07:34:50Z",
      "expires_at_utc": null,
      "github_actor_id": 271768688,
      "github_login": "gomez5757",
      "incompatibility_set_digest": "sha256:fd5b45c1d440fe4a3fddbb5dfad75ad435de9548654c008b76b75c4c86261bd1",
      "recovery_evidence_digest": "sha256:fd5b45c1d440fe4a3fddbb5dfad75ad435de9548654c008b76b75c4c86261bd1",
      "role": "workflow_reviewer",
      "status": "active",
      "transition_event_digest": "sha256:fd5b45c1d440fe4a3fddbb5dfad75ad435de9548654c008b76b75c4c86261bd1"
    },
    {
      "actor_id": "github-user:271768688",
      "approving_actor_ids": [
        "github-user:271768688"
      ],
      "assignment_id": "scientific_reviewer:1",
      "assignment_index": 1,
      "authentication_evidence_digest": "sha256:fd5b45c1d440fe4a3fddbb5dfad75ad435de9548654c008b76b75c4c86261bd1",
      "blocking_reasons": [],
      "custody_domain": "independent_review",
      "deputy_actor_id": null,
      "effective_at_utc": "2026-07-30T07:34:50Z",
      "expires_at_utc": null,
      "github_actor_id": 271768688,
      "github_login": "gomez5757",
      "incompatibility_set_digest": "sha256:fd5b45c1d440fe4a3fddbb5dfad75ad435de9548654c008b76b75c4c86261bd1",
      "recovery_evidence_digest": "sha256:fd5b45c1d440fe4a3fddbb5dfad75ad435de9548654c008b76b75c4c86261bd1",
      "role": "scientific_reviewer",
      "status": "active",
      "transition_event_digest": "sha256:fd5b45c1d440fe4a3fddbb5dfad75ad435de9548654c008b76b75c4c86261bd1"
    },
    {
      "actor_id": "github-user:271768688",
      "approving_actor_ids": [
        "github-user:271768688"
      ],
      "assignment_id": "independent_security_reviewer:1",
      "assignment_index": 1,
      "authentication_evidence_digest": "sha256:fd5b45c1d440fe4a3fddbb5dfad75ad435de9548654c008b76b75c4c86261bd1",
      "blocking_reasons": [],
      "custody_domain": "independent_review",
      "deputy_actor_id": null,
      "effective_at_utc": "2026-07-30T07:34:50Z",
      "expires_at_utc": null,
      "github_actor_id": 271768688,
      "github_login": "gomez5757",
      "incompatibility_set_digest": "sha256:fd5b45c1d440fe4a3fddbb5dfad75ad435de9548654c008b76b75c4c86261bd1",
      "recovery_evidence_digest": "sha256:fd5b45c1d440fe4a3fddbb5dfad75ad435de9548654c008b76b75c4c86261bd1",
      "role": "independent_security_reviewer",
      "status": "active",
      "transition_event_digest": "sha256:fd5b45c1d440fe4a3fddbb5dfad75ad435de9548654c008b76b75c4c86261bd1"
    },
    {
      "actor_id": "github-user:271768688",
      "approving_actor_ids": [
        "github-user:271768688"
      ],
      "assignment_id": "licence_and_acceptable_use_reviewer:1",
      "assignment_index": 1,
      "authentication_evidence_digest": "sha256:fd5b45c1d440fe4a3fddbb5dfad75ad435de9548654c008b76b75c4c86261bd1",
      "blocking_reasons": [],
      "custody_domain": "independent_review",
      "deputy_actor_id": null,
      "effective_at_utc": "2026-07-30T07:34:50Z",
      "expires_at_utc": null,
      "github_actor_id": 271768688,
      "github_login": "gomez5757",
      "incompatibility_set_digest": "sha256:fd5b45c1d440fe4a3fddbb5dfad75ad435de9548654c008b76b75c4c86261bd1",
      "recovery_evidence_digest": "sha256:fd5b45c1d440fe4a3fddbb5dfad75ad435de9548654c008b76b75c4c86261bd1",
      "role": "licence_and_acceptable_use_reviewer",
      "status": "active",
      "transition_event_digest": "sha256:fd5b45c1d440fe4a3fddbb5dfad75ad435de9548654c008b76b75c4c86261bd1"
    },
    {
      "actor_id": "github-user:271768688",
      "approving_actor_ids": [
        "github-user:271768688"
      ],
      "assignment_id": "independent_redaction_reviewer:1",
      "assignment_index": 1,
      "authentication_evidence_digest": "sha256:fd5b45c1d440fe4a3fddbb5dfad75ad435de9548654c008b76b75c4c86261bd1",
      "blocking_reasons": [],
      "custody_domain": "independent_review",
      "deputy_actor_id": null,
      "effective_at_utc": "2026-07-30T07:34:50Z",
      "expires_at_utc": null,
      "github_actor_id": 271768688,
      "github_login": "gomez5757",
      "incompatibility_set_digest": "sha256:fd5b45c1d440fe4a3fddbb5dfad75ad435de9548654c008b76b75c4c86261bd1",
      "recovery_evidence_digest": "sha256:fd5b45c1d440fe4a3fddbb5dfad75ad435de9548654c008b76b75c4c86261bd1",
      "role": "independent_redaction_reviewer",
      "status": "active",
      "transition_event_digest": "sha256:fd5b45c1d440fe4a3fddbb5dfad75ad435de9548654c008b76b75c4c86261bd1"
    },
    {
      "actor_id": "github-user:271768688",
      "approving_actor_ids": [
        "github-user:271768688"
      ],
      "assignment_id": "source_app_manager:1",
      "assignment_index": 1,
      "authentication_evidence_digest": "sha256:fd5b45c1d440fe4a3fddbb5dfad75ad435de9548654c008b76b75c4c86261bd1",
      "blocking_reasons": [],
      "custody_domain": "source",
      "deputy_actor_id": null,
      "effective_at_utc": "2026-07-30T07:34:50Z",
      "expires_at_utc": null,
      "github_actor_id": 271768688,
      "github_login": "gomez5757",
      "incompatibility_set_digest": "sha256:fd5b45c1d440fe4a3fddbb5dfad75ad435de9548654c008b76b75c4c86261bd1",
      "recovery_evidence_digest": "sha256:fd5b45c1d440fe4a3fddbb5dfad75ad435de9548654c008b76b75c4c86261bd1",
      "role": "source_app_manager",
      "status": "active",
      "transition_event_digest": "sha256:fd5b45c1d440fe4a3fddbb5dfad75ad435de9548654c008b76b75c4c86261bd1"
    },
    {
      "actor_id": "github-user:271768688",
      "approving_actor_ids": [
        "github-user:271768688"
      ],
      "assignment_id": "destination_app_manager:1",
      "assignment_index": 1,
      "authentication_evidence_digest": "sha256:fd5b45c1d440fe4a3fddbb5dfad75ad435de9548654c008b76b75c4c86261bd1",
      "blocking_reasons": [],
      "custody_domain": "destination",
      "deputy_actor_id": null,
      "effective_at_utc": "2026-07-30T07:34:50Z",
      "expires_at_utc": null,
      "github_actor_id": 271768688,
      "github_login": "gomez5757",
      "incompatibility_set_digest": "sha256:fd5b45c1d440fe4a3fddbb5dfad75ad435de9548654c008b76b75c4c86261bd1",
      "recovery_evidence_digest": "sha256:fd5b45c1d440fe4a3fddbb5dfad75ad435de9548654c008b76b75c4c86261bd1",
      "role": "destination_app_manager",
      "status": "active",
      "transition_event_digest": "sha256:fd5b45c1d440fe4a3fddbb5dfad75ad435de9548654c008b76b75c4c86261bd1"
    },
    {
      "actor_id": "github-user:271768688",
      "approving_actor_ids": [
        "github-user:271768688"
      ],
      "assignment_id": "source_deadman_operator:1",
      "assignment_index": 1,
      "authentication_evidence_digest": "sha256:fd5b45c1d440fe4a3fddbb5dfad75ad435de9548654c008b76b75c4c86261bd1",
      "blocking_reasons": [],
      "custody_domain": "source",
      "deputy_actor_id": null,
      "effective_at_utc": "2026-07-30T07:34:50Z",
      "expires_at_utc": null,
      "github_actor_id": 271768688,
      "github_login": "gomez5757",
      "incompatibility_set_digest": "sha256:fd5b45c1d440fe4a3fddbb5dfad75ad435de9548654c008b76b75c4c86261bd1",
      "recovery_evidence_digest": "sha256:fd5b45c1d440fe4a3fddbb5dfad75ad435de9548654c008b76b75c4c86261bd1",
      "role": "source_deadman_operator",
      "status": "active",
      "transition_event_digest": "sha256:fd5b45c1d440fe4a3fddbb5dfad75ad435de9548654c008b76b75c4c86261bd1"
    },
    {
      "actor_id": "github-user:271768688",
      "approving_actor_ids": [
        "github-user:271768688"
      ],
      "assignment_id": "source_deadman_deputy:1",
      "assignment_index": 1,